{
  "$schema": "../../manifests/core-source-set.schema.json",
  "schema_version": 1,
  "source_set_id": "gambatte-dfc165599f3f-9a6aa3658c05",
  "local_only": true,
  "publication": "disabled",
  "evidence_pin": {
    "path": "pins/core-sets/gambatte-dfc165599f3f-9a6aa3658c05.json",
    "pin_id": "gambatte-dfc165599f3f-9a6aa3658c05",
    "file_sha256": "f427164f8e16c7acbd9f0f0d40265e0924287a37878bd637bc0808f9372b82cc",
    "content_sha256": "d18b5891bea3ceacbc7d6896ec561f1f2a709ae0544c05b205afe1517e3e5ef6"
  },
  "sources": {
    "gambatte": {
      "path": "pins/sources/gambatte/dfc165599f3f1068c40a0b7ad6fe5f161283d483.json",
      "source_lock_id": "gambatte-dfc165599f3f",
      "commit": "dfc165599f3f1068c40a0b7ad6fe5f161283d483",
      "file_sha256": "042a617ed269741196eff3d2738f3dc72f1ba82443355075db3b6ac5466ea9dd",
      "content_sha256": "219ef7bc2c58c1ed873c6e737bb61154aeffec15026686ceddc7f9477318fac0"
    }
  },
  "content_sha256": "464f1c6bec0dac096744694d59a69c1bddbdbf12293449a87bca317edfe5f6ae"
}
