{
  "$schema": "../../manifests/core-source-set.schema.json",
  "schema_version": 1,
  "source_set_id": "lowresnx-35adc1a215e9-c989201653bb",
  "local_only": true,
  "publication": "disabled",
  "evidence_pin": {
    "path": "pins/core-sets/lowresnx-35adc1a215e9-c989201653bb.json",
    "pin_id": "lowresnx-35adc1a215e9-c989201653bb",
    "file_sha256": "d83c4a68bfaab6fec18ecbf7ccf64d9c2eac3306c9ab8218748d29473a2f94ee",
    "content_sha256": "51c709c6010581b1ac72da560c45d1ea63304f8fbedb6f58fc788d613b5a4c86"
  },
  "sources": {
    "lowresnx": {
      "path": "pins/sources/lowresnx/35adc1a215e975be964b2ef4b652117acd7beba1.json",
      "source_lock_id": "lowresnx-35adc1a215e9",
      "commit": "35adc1a215e975be964b2ef4b652117acd7beba1",
      "file_sha256": "7e2567911869847ba52daf8a28867854db5fd93fed2723c2d16c2ddc59b95473",
      "content_sha256": "9af4c42d7e184aae60553d405e114715d533b4f9eb84a8a9678b498842d01ae4"
    }
  },
  "content_sha256": "894547d158bd4b611f4010c27b65ea4053c8c8a4b778afe53b8fe8feff81a562"
}
