{
  "$schema": "../../manifests/core-source-set.schema.json",
  "schema_version": 1,
  "source_set_id": "cap32-4abfb8be233b-82ddcfcacee0",
  "local_only": true,
  "publication": "disabled",
  "evidence_pin": {
    "path": "pins/core-sets/cap32-4abfb8be233b-82ddcfcacee0.json",
    "pin_id": "cap32-4abfb8be233b-82ddcfcacee0",
    "file_sha256": "1a3e96431f865e5181ed22c7d89336c4e3bfcbeef40f211ad84526dca8c24b63",
    "content_sha256": "83c8540bf021174c904751a99e3b95277c16dd36af11984a0714fd23acd3621a"
  },
  "sources": {
    "cap32": {
      "path": "pins/sources/cap32/4abfb8be233bec630f369379fb6c1d92d31f1c7d.json",
      "source_lock_id": "cap32-4abfb8be233b",
      "commit": "4abfb8be233bec630f369379fb6c1d92d31f1c7d",
      "file_sha256": "12ea97147599eaf8f7d7a4ae90bebf014a67e9a18a958e5296b0d54d1251a8b7",
      "content_sha256": "dd74cb116a010edd1c9366003e89d4c956f2c2324e6721c9a31afeb3388805db"
    }
  },
  "content_sha256": "d69d4deef2a78e4bd9b352672c46aad1236f6ac0083345e9ace14bf47086bec9"
}
