{
  "$schema": "../../manifests/core-source-set.schema.json",
  "schema_version": 1,
  "source_set_id": "pokemini-bb009b1379ad-2f63e84b7b68",
  "local_only": true,
  "publication": "disabled",
  "evidence_pin": {
    "path": "pins/core-sets/pokemini-bb009b1379ad-2f63e84b7b68.json",
    "pin_id": "pokemini-bb009b1379ad-2f63e84b7b68",
    "file_sha256": "9677f87f64f74aec84d07920e16322d4e962a8eb6c610180a373f2deedef65c8",
    "content_sha256": "d3af231b7bb453e92fc573a63195e3edb8e5734f923244082184d22296336794"
  },
  "sources": {
    "pokemini": {
      "path": "pins/sources/pokemini/bb009b1379ad15f1514f20ca7cbf710b4af42b3e.json",
      "source_lock_id": "pokemini-bb009b1379ad",
      "commit": "bb009b1379ad15f1514f20ca7cbf710b4af42b3e",
      "file_sha256": "dfd9529d7ca237d7d402b319fa8b76fe2e27bd7b1b676d039b9be5e3c71cf421",
      "content_sha256": "6c1d7924a0475a4dfa1c51344fa9f5f2dc4b86fa17fba6aea706c97f0f760651"
    }
  },
  "content_sha256": "ba12d042d8be65ead5663d8342a5ad8c3714e760b0626c7b8b75f3a21f3fb495"
}
