{
  "$schema": "../../manifests/core-source-set.schema.json",
  "schema_version": 1,
  "source_set_id": "crocods-87bbb3d9007a-987ab7429a42",
  "local_only": true,
  "publication": "disabled",
  "evidence_pin": {
    "path": "pins/core-sets/crocods-87bbb3d9007a-987ab7429a42.json",
    "pin_id": "crocods-87bbb3d9007a-987ab7429a42",
    "file_sha256": "d1712d092ab545b5cbaa5432f4eefdd708f887f02c1a745422ecba151190c2ea",
    "content_sha256": "3c815c61ab37ad61c2c690e81a31962af8266e4b777b50cad87e3552110b96e2"
  },
  "sources": {
    "crocods": {
      "path": "pins/sources/crocods/87bbb3d9007ac537864278c6c3149ae3291873f8.json",
      "source_lock_id": "crocods-87bbb3d9007a",
      "commit": "87bbb3d9007ac537864278c6c3149ae3291873f8",
      "file_sha256": "8d9b5b70fde49c6240d7d2420cf7b166eeb23bd791e7b60a2b0afa6fb4f5fc53",
      "content_sha256": "153fa581737cacd3879922bacdfbbd2114651af6d8b900daef8c571e267e5268"
    }
  },
  "content_sha256": "89f714452581c5f2be1b7b436bdb669e4d4c7c67b6de4ae3bb595d750a3b4e02"
}
