{
  "$schema": "../../manifests/core-source-set.schema.json",
  "schema_version": 1,
  "source_set_id": "x1-3e7960a433c3-7cd0bec23b7c",
  "local_only": true,
  "publication": "disabled",
  "evidence_pin": {
    "path": "pins/core-sets/x1-3e7960a433c3-7cd0bec23b7c.json",
    "pin_id": "x1-3e7960a433c3-7cd0bec23b7c",
    "file_sha256": "93e6073745d9f3884bb048600c47918938ce639a9c7e3b58b93f52a747165d8e",
    "content_sha256": "8dfa896964d71d9aa774c258d976675fbd077bdba65ea310bec9fb01a7c3bc76"
  },
  "sources": {
    "x1": {
      "path": "pins/sources/x1/3e7960a433c3bca820f8b8f5511a2b92bd666829.json",
      "source_lock_id": "x1-3e7960a433c3",
      "commit": "3e7960a433c3bca820f8b8f5511a2b92bd666829",
      "file_sha256": "71471f43c8e6539fd8128d9789f5eedfe8949156f4bb95f5b492fc7ccaa244f5",
      "content_sha256": "12eddfa12cd053b81fed77d2112f41df19599e6ad6cf65f157f3ceaf36c2b695"
    }
  },
  "content_sha256": "cf3fd270a2a9b86d374bc58c7cb03cbb45092b94e3b6a3d6e2138be1bdae762d"
}
