{
  "$schema": "../../manifests/core-source-set.schema.json",
  "schema_version": 1,
  "source_set_id": "tic80-e7f48a30ea3e-0d4f7ea2e381",
  "local_only": true,
  "publication": "disabled",
  "evidence_pin": {
    "path": "pins/core-sets/tic80-e7f48a30ea3e-0d4f7ea2e381.json",
    "pin_id": "tic80-e7f48a30ea3e-0d4f7ea2e381",
    "file_sha256": "682db3ac6928cd0da8a41ba30056de860f45eec16722b1fae9adeba0cd940b20",
    "content_sha256": "c9a175c04ba919f34697b7466ba115562ef3e88742d8419d56bc615f3cd07b2e"
  },
  "sources": {
    "tic80": {
      "path": "pins/sources/tic80/e7f48a30ea3e205810366aad910a2985edcd1f58.json",
      "source_lock_id": "tic80-e7f48a30ea3e",
      "commit": "e7f48a30ea3e205810366aad910a2985edcd1f58",
      "file_sha256": "8f4a1437f1c2049a36d5c457f39bb105d2413cb35fce317fe3d963393ceb812a",
      "content_sha256": "591bff3a05e828409a661604de24952f0e04893b1e58188d4b110b3a059782ba"
    }
  },
  "content_sha256": "87c2b98f424e6697aa1ceeecd1ed00e62c8c069d673fa6c02f1bcb9de4e97014"
}
