{
  "$schema": "../../manifests/core-source-set.schema.json",
  "schema_version": 1,
  "source_set_id": "mednafen_pcfx-650c30ea2203-5c0f9a256d9a",
  "local_only": true,
  "publication": "disabled",
  "evidence_pin": {
    "path": "pins/core-sets/mednafen_pcfx-650c30ea2203-5c0f9a256d9a.json",
    "pin_id": "mednafen_pcfx-650c30ea2203-5c0f9a256d9a",
    "file_sha256": "4849821e52373701e76beb6d754d38181ce7f3956633f3f6c246e37aabd7a148",
    "content_sha256": "7bd4336ad9935ceca582c87f07ee59e3e95d91cc4ec7679ec7af6d942f44d555"
  },
  "sources": {
    "mednafen_pcfx": {
      "path": "pins/sources/mednafen_pcfx/650c30ea2203636a1716675854d11c608ed6eacc.json",
      "source_lock_id": "mednafen_pcfx-650c30ea2203",
      "commit": "650c30ea2203636a1716675854d11c608ed6eacc",
      "file_sha256": "eb00ee54c7cfd4105f57730fd91d302e653e802f110485dee1c0ede5ada5ef94",
      "content_sha256": "23cdd98165e6d547fb9488006ec11bf7da12e746d1fddbf9a6a8d356a59bc861"
    }
  },
  "content_sha256": "320c8d4ef433ec14649549c1335f59fd384920f10ec8e63bf21323fc85d550ab"
}
