{
  "$schema": "../../manifests/core-source-set.schema.json",
  "schema_version": 1,
  "source_set_id": "uw8-92e0f7a7678d-71daa2676bc9",
  "local_only": true,
  "publication": "disabled",
  "evidence_pin": {
    "path": "pins/core-sets/uw8-92e0f7a7678d-71daa2676bc9.json",
    "pin_id": "uw8-92e0f7a7678d-71daa2676bc9",
    "file_sha256": "f439d4910dc63dabf39ae636ce7b1443ba60cec2803c6fe908f7ab067ad268c7",
    "content_sha256": "e476eea57f9fb4ee11858cf2e9ef870333faba98e6217a9acf38a1baa5986708"
  },
  "sources": {
    "uw8": {
      "path": "pins/sources/uw8/92e0f7a7678de9955002ecce8501eb1be5e46d35.json",
      "source_lock_id": "uw8-92e0f7a7678d",
      "commit": "92e0f7a7678de9955002ecce8501eb1be5e46d35",
      "file_sha256": "522e560899c831f6902280b6529e68a961a57bf7b6c5e476fab31d4b26f6e0fa",
      "content_sha256": "e99825ea706a83f42714ef3b88a62f9556785626d36ac687e1d595db73b0188d"
    }
  },
  "content_sha256": "1522fafc34271cb1f7e2396a32b4488d87919ed543357cbada0b82d5caa3bc34"
}
