{
  "$schema": "../../manifests/core-source-set.schema.json",
  "schema_version": 1,
  "source_set_id": "snes9x2005_plus-b60356971fc9-1d19ddd8a238",
  "local_only": true,
  "publication": "disabled",
  "evidence_pin": {
    "path": "pins/core-sets/snes9x2005_plus-b60356971fc9-1d19ddd8a238.json",
    "pin_id": "snes9x2005_plus-b60356971fc9-1d19ddd8a238",
    "file_sha256": "1cfcb1ed4d660903c4e9c499b288e7d5af850fbc30c7ff5cf0973f71170b341d",
    "content_sha256": "3cc96125962ac552d0100fec07a3b4c62f7358d03852443357efea038463bcc5"
  },
  "sources": {
    "snes9x2005_plus": {
      "path": "pins/sources/snes9x2005_plus/b60356971fc9caae02cd0853676dced886a08be7.json",
      "source_lock_id": "snes9x2005_plus-b60356971fc9",
      "commit": "b60356971fc9caae02cd0853676dced886a08be7",
      "file_sha256": "6865862ac006808a9f468ba73df9b99a292803ac140bc78449af72f134d74292",
      "content_sha256": "300c8502d4367895195dfcf84cd30ceff75ab84eedfeedba39097187b016358a"
    }
  },
  "content_sha256": "bba0099bd3aa11a38873bc776d1b77f525c163da4fc1a6dd04a0d5b31f0f1301"
}
