{
  "$schema": "../../manifests/core-source-set.schema.json",
  "schema_version": 1,
  "source_set_id": "px68k-cc45b55983b4-ca10d194866e",
  "local_only": true,
  "publication": "disabled",
  "evidence_pin": {
    "path": "pins/core-sets/px68k-cc45b55983b4-ca10d194866e.json",
    "pin_id": "px68k-cc45b55983b4-ca10d194866e",
    "file_sha256": "164bc52033b8d1d874a8ae02f7b7f3431fbe09e349b004cbc367912e1325dffc",
    "content_sha256": "137c752f42ea4954a5dc2059be37af2b8fff54f0171ed604796bcf9d4ce55669"
  },
  "sources": {
    "px68k": {
      "path": "pins/sources/px68k/cc45b55983b4d30c961a313a77df9bcf9461dc63.json",
      "source_lock_id": "px68k-cc45b55983b4",
      "commit": "cc45b55983b4d30c961a313a77df9bcf9461dc63",
      "file_sha256": "0727eccc6160e7489365c09f56524069cd28cfa4fac5ada80f1cf470e691b67c",
      "content_sha256": "77e047efecf1fc79a75cffe280bc0a25ac3be247f4aae95352e523f8210c7ce3"
    }
  },
  "content_sha256": "eca109c6144b64d26fbc6f54133f065664f14f1f73fe68ce491ee2dc7935c167"
}
