{
  "$schema": "../../manifests/core-source-set.schema.json",
  "schema_version": 1,
  "source_set_id": "fuse-bce196fb7748-3ab0f62b05f8",
  "local_only": true,
  "publication": "disabled",
  "evidence_pin": {
    "path": "pins/core-sets/fuse-bce196fb7748-3ab0f62b05f8.json",
    "pin_id": "fuse-bce196fb7748-3ab0f62b05f8",
    "file_sha256": "45448246e09c21df6883c2f9f76048090ae26d840f5c8373e31ffaf1cd22502d",
    "content_sha256": "b7e539c8741e8869c389395f5059a511bd24ea193d9326fab5da12ede72f7c24"
  },
  "sources": {
    "fuse": {
      "path": "pins/sources/fuse/bce196fb774835fe65b3e5b821887a4ccf657167.json",
      "source_lock_id": "fuse-bce196fb7748",
      "commit": "bce196fb774835fe65b3e5b821887a4ccf657167",
      "file_sha256": "9e2d61883093a7cdb8b57686fc6279aeeed427757d8828dbcab8a020e7b95bc0",
      "content_sha256": "235f5875dd3fea2e6558f4527d59977c4dc0c17140a3dc589157ea8178dbf27b"
    }
  },
  "content_sha256": "96bd0ff3fc9ac3a7574e67b8a31bda75e5a890ed67519f87ff073fe13bfbf05f"
}
