{
  "$schema": "../../manifests/core-source-set.schema.json",
  "schema_version": 1,
  "source_set_id": "vice_x64-7946cfa0d377-4b611c28b848",
  "local_only": true,
  "publication": "disabled",
  "evidence_pin": {
    "path": "pins/core-sets/vice_x64-7946cfa0d377-4b611c28b848.json",
    "pin_id": "vice_x64-7946cfa0d377-4b611c28b848",
    "file_sha256": "e3ef3d9e36037ddbb914dc4c41bc136ba3627ad4cfb2564f01f44799813f181d",
    "content_sha256": "230c8ebb4025ef7876bb74ad20b6b62285f2205a198c892c5fc83bf01a1f958e"
  },
  "sources": {
    "vice_x64": {
      "path": "pins/sources/vice_x64/7946cfa0d3775e958616d4d107de867a4616ae6c.json",
      "source_lock_id": "vice_x64-7946cfa0d377",
      "commit": "7946cfa0d3775e958616d4d107de867a4616ae6c",
      "file_sha256": "28889e0d4f80bfb1e6efa082aa231ff8c8c355ef60f1b37caf8e7abfa326f399",
      "content_sha256": "d5d918cb679dfa3ea51a8efca2798cb6051d8fcf139d8519955a476a42d4841e"
    }
  },
  "content_sha256": "ee91f498e16eca83b710c71bae4d28ee8636dbcb348ee1729a229088a4f9d1a3"
}
