{
  "$schema": "../../manifests/core-source-set.schema.json",
  "schema_version": 1,
  "source_set_id": "mednafen_wswan-da6d0d9acb8d-da715bbcb6da",
  "local_only": true,
  "publication": "disabled",
  "evidence_pin": {
    "path": "pins/core-sets/mednafen_wswan-da6d0d9acb8d-da715bbcb6da.json",
    "pin_id": "mednafen_wswan-da6d0d9acb8d-da715bbcb6da",
    "file_sha256": "2b8b71a4f5184c71d857fe3b38b04e86348dd7cb11aa5a5db78524a5939ec2fb",
    "content_sha256": "79f2c71fe4f19c57cecb5d5f9d8d7c55aa4838e337ecd31530f5fa2c2b4b6818"
  },
  "sources": {
    "mednafen_wswan": {
      "path": "pins/sources/mednafen_wswan/da6d0d9acb8d4e9bd6725ab44225a275325d8352.json",
      "source_lock_id": "mednafen_wswan-da6d0d9acb8d",
      "commit": "da6d0d9acb8d4e9bd6725ab44225a275325d8352",
      "file_sha256": "00ab60ca4885169e8d0dbaa225270cc5f03a7212909b106d448dfa402ec20846",
      "content_sha256": "c6686a1f63389f864d997c54d19d22e7ac701f0b87e3ee2ff6518841ef6390ec"
    }
  },
  "content_sha256": "43b95f07e30cb46503c9f714f43de7bf7b3c040c9d0998980086f683906dfc2e"
}
