{
  "$schema": "../../manifests/core-source-set.schema.json",
  "schema_version": 1,
  "source_set_id": "vice_x64-7946cfa0d377-290256f3bebd",
  "local_only": true,
  "publication": "disabled",
  "evidence_pin": {
    "path": "pins/core-sets/vice_x64-7946cfa0d377-290256f3bebd.json",
    "pin_id": "vice_x64-7946cfa0d377-290256f3bebd",
    "file_sha256": "9eaedc5f925c06a95c30391bf2df6630f00c4b094d1cf9d355ad404a4bbc41af",
    "content_sha256": "163447fb39c86424702b5c8a4e3f073e3f0190e0f621b9b33d9131e2e1260687"
  },
  "sources": {
    "vice_x64": {
      "path": "pins/sources/vice_x64/7946cfa0d3775e958616d4d107de867a4616ae6c.json",
      "source_lock_id": "vice_x64-7946cfa0d377",
      "commit": "7946cfa0d3775e958616d4d107de867a4616ae6c",
      "file_sha256": "28889e0d4f80bfb1e6efa082aa231ff8c8c355ef60f1b37caf8e7abfa326f399",
      "content_sha256": "d5d918cb679dfa3ea51a8efca2798cb6051d8fcf139d8519955a476a42d4841e"
    }
  },
  "content_sha256": "007f994aa59efff6b40b017405a5d3c662834b2578d6a2e7ace67bc2c9354d18"
}
